<lccdd xmlns:compact="http://www.lcsim.org/schemas/compact/1.0"
       xmlns:xs="http://www.w3.org/2001/XMLSchema-instance"
       xs:noNamespaceSchemaLocation="http://www.lcsim.org/schemas/compact/1.0/compact.xsd">

  <info name="EcalBarrelTest">
  </info>

  <define>

    <!-- world -->
    <constant name="world_side" value="15000" />
    <constant name="world_x" value="world_side" />
    <constant name="world_y" value="world_side" />
    <constant name="world_z" value="world_side" />

    <!-- tracking region -->
    <constant name="tracking_region_radius" value="127.0"/>
    <constant name="tracking_region_zmax" value="168.0"/>
    
  </define>

  <materials>
  </materials>

  <display>
    <vis name="DetectorVis" r="0.77" g="0.74" b="0.86" showDaughters="true" visible="true"/>
    <vis name="StaveVis" r="0.77" g="0.74" b="0.86" showDaughters="false" visible="true"/>
    <vis name="LayerVis" r="1.0" g="0.0" b="0.0" showDaughters="true" visible="false"/>
    <vis name="SensorVis" r="0.0" g="1.0" b="0.0" showDaughters="false" visible="true"/>
    <vis name="AbsorberVis" r="0.0" g="0.0" b="1.0" showDaughters="false" visible="true"/>
  </display>

  <detectors>
    <detector id="1" name="EcalBarrel" type="EcalBarrel" readout="EcalBarrHits" vis="DetectorVis">
      <dimensions numsides="8" rmin="1700.0" z="546.0 * 2" />
      <staves vis="StaveVis"/>
      <layer repeat="8" vis="LayerVis">
        <slice material="Silicon" thickness="10.0" sensitive="yes" vis="SensorVis"/>
<!--        <slice material="Air" thickness="2.0" sensitive="yes" vis="InvisibleNoDaughters"/>-->
        <slice material="Lead" thickness="20.0" sensitive="yes" vis="AbsorberVis"/>
      </layer>
    </detector>
  </detectors>

  <readouts>
         <readout name="EcalBarrHits">
             <segmentation type="GridXYZ" gridSizeX="1.0" gridSizeY="1.0" />
	     <id>layer:8,system:6,barrel:3,module:4,slice:6,x:32:-15,y:-15</id>
         </readout>
   </readouts>

   <fields>
   </fields>
</lccdd>
