<lccdd xmlns:compact="http://www.lcsim.org/schemas/compact/1.0"
       xmlns:xs="http://www.w3.org/2001/XMLSchema-instance"
       xs:noNamespaceSchemaLocation="http://www.lcsim.org/schemas/compact/1.0/compact.xsd">

  <!-- info tag containing author, version, time, unique id (url) -->
  <info name="GDMLIncludeTest">
    <comment>
      Test of the compact format for sdjan03 detector.
    </comment>
  </info>

  <!-- Constants -->
  <define>
  
    <!-- world -->
    <constant name="world_side" value="15000" />
    <constant name="world_x" value="world_side" />
    <constant name="world_y" value="world_side" />
    <constant name="world_z" value="world_side" />
    
    <!-- tracking region -->
    <constant name="tracking_region_radius" value="127.0*cm"/>
    <constant name="tracking_region_zmax" value="168.0*cm"/>
        
  </define>

  <materials>

    <!-- so can easily replace references 
         with something more realistic later -->
    <material  name="MuonAir"  >
      <D type="density" unit="g/cm3" value="0.0012"/>
      <fraction n="0.7803"  ref="N"/>
      <fraction n="0.2103"  ref="O"/>
      <fraction n="0.0094"  ref="Ar"/>
    </material>
    
  </materials>
    
  <detectors>
    
    <detector id="1" name="HADBarrel" type="CylindricalBarrelCalorimeter" readout="HcalBarrHits">
      <dimensions inner_r = "144.0*cm" outer_z = "286.0*cm" />
      <layer repeat="1">
        <slice material = "Polystyrene" thickness = "1.0*cm" sensitive = "yes" />
      </layer>
      <parameter name="CALTYPE">HCAL</parameter>
    </detector>    
  </detectors>

  <readouts>
    <readout name="HcalBarrHits"> 
      <segmentation type="ProjectiveCylinder" thetaBins="600" phiBins="1200"/>
      <id>layer:7,system:3,barrel:3,theta:32:11,phi:11</id>
    </readout>
  </readouts>

  <fields>    
  </fields>

  <includes>
    <gdmlFile ref="http://www.lcsim.org/test/gdml/box.gdml" />
  </includes>

</lccdd>
