<lccdd xmlns:compact="http://www.lcsim.org/schemas/compact/1.0"
       xmlns:xs="http://www.w3.org/2001/XMLSchema-instance"
       xs:noNamespaceSchemaLocation="http://www.lcsim.org/schemas/compact/1.0/compact.xsd">

  <info name="sidEcalTestbeam">
    <comment>SiD ECal Test beam module 2014.01.15 Norman Graf</comment>
  </info>

  <define>

    <constant name="cm" value="10"/>

    <!-- world -->
    <constant name="world_side" value="3000*cm" />
    <constant name="world_x" value="world_side" />
    <constant name="world_y" value="world_side" />
    <constant name="world_z" value="world_side" />

    <!-- tracking region -->
    <constant name="tracking_region_radius" value="150.0*cm"/>
    <constant name="tracking_region_zmax" value="200.0*cm"/>

  </define>

  <materials>
        <material name="TungstenDens23">
            <D value="17.66" unit="g/cm3"/>
            <fraction n="0.925" ref="W"/>
            <fraction n="0.050" ref="Ni"/>
            <fraction n="0.025" ref="Cu"/>
        </material>
  </materials>

    <limits>
        <limitset name="cal_limits">
            <limit name="step_length_max" particles="*" value="3.5" unit="mm" />
        </limitset>
    </limits>

  <detectors>

    <detector id="1"
              name="SiDTestBeamCalorimeter"
              type="TestBeamCalorimeter"
              readout="CalHits"
              insideTrackingVolume="true">
             <dimensions x="6.0 * cm" y="6.0 * cm" />
             <position x="0.0 * cm" y="0.0 * cm" z="10.0*cm" />
             <layer repeat="1">
                <slice material = "Kapton"  thickness = "0.030*cm" />
                <slice material = "Copper"  thickness = "0.005*cm" />                
                <slice material = "Silicon" thickness = "0.032*cm" sensitive = "yes" limits="cal_limits" />                
            </layer>
            <layer repeat="20">
                <slice material = "TungstenDens23" thickness = "0.254*cm" />
                <slice material = "Air"     thickness = "0.098*cm" />
                <slice material = "Kapton"  thickness = "0.030*cm" />
                <slice material = "Copper"  thickness = "0.005*cm" />
                <slice material = "Silicon" thickness = "0.032*cm" sensitive = "yes" limits="cal_limits" />
            </layer>
            <layer repeat="10">
                <slice material = "TungstenDens23" thickness = "0.508*cm" />
                <slice material = "Air"     thickness = "0.098*cm" />
                <slice material = "Kapton"  thickness = "0.030*cm" />
                <slice material = "Copper"  thickness = "0.005*cm" />
                <slice material = "Silicon" thickness = "0.032*cm" sensitive = "yes" limits="cal_limits" />
            </layer>
    </detector>
  </detectors>

  <readouts>
        <readout name="CalHits">
            <segmentation type="GlobalGridXY" gridSizeX="3.5" gridSizeY="3.5" />
            <id>system:6,barrel:3,module:4,layer:6,slice:5,x:32:-16,y:-16</id>
        </readout>
   </readouts>
    <fields/>
</lccdd>
