<lccdd xmlns:compact="http://www.lcsim.org/schemas/compact/1.0"
       xmlns:xs="http://www.w3.org/2001/XMLSchema-instance"
       xs:noNamespaceSchemaLocation="http://www.lcsim.org/schemas/compact/1.0/compact.xsd">

  <!-- info tag containing author, version, time, unique id (url) -->
  <info name="Detector">
    <comment>
      Compact format template file.
    </comment>
  </info>

  <!-- Constants -->
  <define>
  
    <!-- world -->
    <constant name="world_side" value="15000" />
    <constant name="world_x" value="world_side" />
    <constant name="world_y" value="world_side" />
    <constant name="world_z" value="world_side" />
    
    <!-- tracking region -->
    <constant name="tracking_region_radius" value="127.0*cm"/>
    <constant name="tracking_region_zmax" value="168.0*cm"/>    
    
  </define>

  <materials>

      <!-- elements -->
      <element name="Ar" Z="18.0" N="40" >
	<atom type="A" unit="g/mol" value="39.9480" />
      </element>

      <element  name="N"  Z="7.0"  N="14" >
	<atom type="A" unit="g/mol" value=" 14.0100" />
      </element>

      <element  name="O"  Z="8.0"  N="16" >
	<atom type="A" unit="g/mol" value=" 16.0000" />
      </element>

      <!-- materials -->
      <material  name="Air"  >
	<D type="density" unit="g/cm3" value="0.0012"/>
	<fraction n="0.7803"  ref="N"/>
	<fraction n="0.2103"  ref="O"/>
	<fraction n="0.0094"  ref="Ar"/>
      </material>
      
  </materials>
  
  <detectors>    
    <detector id="0" name="NPCylTestDet" type="CylindricalCalorimeter" readout="NPCylTest" detectorType="calorimeter">
      <dimensions inner_r="100.0 * cm" outer_z="200.0 * cm" />
      <layer repeat="1">
	<slice material="Air" thickness="100.0 * cm" sensitive="yes" />
      </layer>
    </detector>
  </detectors>

  <readouts>
    <readout name="NPCylTest">
      <segmentation type="NonprojectiveCylinder" gridSizePhi="1.0" gridSizeZ="1.0"/>
      <id>layer:7,system:3,barrel:3,phi:32:11,z:11</id>
    </readout>
  </readouts>
  
  <fields>
    <field type="Solenoid" name="GlobalSolenoid"
	   inner_field="5.0"
	   outer_field="-0.6"
	   zmax="1000"
	   outer_radius="144*cm+(2+1)*34*cm" />
  </fields>
</lccdd> 
